{
  "format": "keepraw-fly",
  "formatVersion": "0.1.0",
  "profile": {
    "name": {
      "romanized": "Flight list review",
      "primary": "romanized"
    }
  },
  "flights": [
    {
      "id": "zh9911",
      "flightNumber": "ZH9911",
      "airline": {
        "iata": "ZH"
      },
      "origin": {
        "iata": "TAO"
      },
      "destination": {
        "iata": "KHN"
      },
      "serviceDate": "2026-09-17",
      "scheduledDeparture": "2026-09-17T10:20:00+08:00",
      "scheduledArrival": "2026-09-17T13:05:00+08:00",
      "actualDeparture": "2026-09-17T10:57:00+08:00",
      "actualArrival": "2026-09-17T13:31:00+08:00"
    },
    {
      "id": "cx954",
      "flightNumber": "CX954",
      "airline": {
        "iata": "CX"
      },
      "origin": {
        "iata": "HKG"
      },
      "destination": {
        "iata": "TAO"
      },
      "serviceDate": "2026-09-15",
      "scheduledDeparture": "2026-09-15T10:20:00+08:00",
      "scheduledArrival": "2026-09-15T13:05:00+08:00",
      "actualDeparture": "2026-09-15T10:57:00+08:00",
      "actualArrival": "2026-09-15T13:31:00+08:00"
    },
    {
      "id": "cx696",
      "flightNumber": "CX696",
      "airline": {
        "iata": "CX"
      },
      "origin": {
        "iata": "BOM"
      },
      "destination": {
        "iata": "HKG"
      },
      "serviceDate": "2026-09-13",
      "scheduledDeparture": "2026-09-13T23:28:00+05:30",
      "scheduledArrival": "2026-09-14T06:50:00+08:00",
      "actualDeparture": "2026-09-13T23:39:00+05:30",
      "actualArrival": "2026-09-14T06:15:00+08:00"
    },
    {
      "id": "et809",
      "flightNumber": "ET809",
      "airline": {
        "iata": "ET"
      },
      "origin": {
        "iata": "ADD"
      },
      "destination": {
        "iata": "JNB"
      },
      "serviceDate": "2026-09-12",
      "scheduledDeparture": "2026-09-12T10:20:00+08:00",
      "scheduledArrival": "2026-09-12T13:05:00+08:00"
    },
    {
      "id": "ca128",
      "flightNumber": "CA128",
      "airline": {
        "iata": "CA"
      },
      "origin": {
        "iata": "NRT"
      },
      "destination": {
        "iata": "TPE"
      },
      "serviceDate": "2026-09-11",
      "scheduledDeparture": "2026-09-11T10:20:00+08:00",
      "scheduledArrival": "2026-09-11T13:05:00+08:00",
      "actualDeparture": "2026-09-11T10:57:00+08:00",
      "actualArrival": "2026-09-11T13:31:00+08:00"
    },
    {
      "id": "af123",
      "flightNumber": "AF123",
      "airline": {
        "iata": "AF"
      },
      "origin": {
        "iata": "CDG"
      },
      "destination": {
        "iata": "LHR"
      },
      "serviceDate": "2026-09-10",
      "scheduledDeparture": "2026-09-10T10:20:00+08:00",
      "scheduledArrival": "2026-09-10T13:05:00+08:00",
      "cancelled": true
    },
    {
      "id": "ca156",
      "flightNumber": "CA156",
      "airline": {
        "iata": "CA"
      },
      "origin": {
        "iata": "PEK"
      },
      "destination": {
        "iata": "SHA"
      },
      "serviceDate": "2026-09-09",
      "scheduledDeparture": "2026-09-09T10:20:00+08:00",
      "scheduledArrival": "2026-09-09T13:05:00+08:00",
      "actualDeparture": "2026-09-09T10:57:00+08:00",
      "actualArrival": "2026-09-09T13:31:00+08:00",
      "divertedTo": {
        "iata": "NKG"
      }
    }
  ]
}
